{
  "$schema": "http://json-schema.org/draft-07/schema#",
  "definitions": {
    "OptimizeRecommendation": {
      "description": "One materialization-strategy recommendation. Mirrors `rocky_core::optimize::MaterializationCost` but lives in the CLI crate so we don't have to derive JsonSchema across the workspace.",
      "properties": {
        "compute_cost_per_run": {
          "description": "Projected per-run compute cost (USD). Populated from `rocky_core::optimize::MaterializationCost::compute_cost_per_run` so Dagster's `checks.py` can surface it as metadata without re-deriving from config.",
          "format": "double",
          "type": "number"
        },
        "current_strategy": {
          "type": "string"
        },
        "downstream_references": {
          "description": "How many downstream models depend on this one. Drives whether the recommendation favours table materialisation (many consumers) vs a view.",
          "format": "uint64",
          "minimum": 0.0,
          "type": "integer"
        },
        "estimated_monthly_savings": {
          "format": "double",
          "type": "number"
        },
        "model_name": {
          "type": "string"
        },
        "reasoning": {
          "type": "string"
        },
        "recommended_strategy": {
          "type": "string"
        },
        "storage_cost_per_month": {
          "description": "Projected monthly storage cost (USD).",
          "format": "double",
          "type": "number"
        }
      },
      "required": [
        "compute_cost_per_run",
        "current_strategy",
        "downstream_references",
        "estimated_monthly_savings",
        "model_name",
        "reasoning",
        "recommended_strategy",
        "storage_cost_per_month"
      ],
      "type": "object"
    },
    "ProductionRunScope": {
      "description": "Which runs a report about production counted (#2201).\n\nShadow and branch runs are never counted. Runs recorded before runs carried a scope are counted or not per report, and `unrecorded_runs_counted` says which.",
      "properties": {
        "excluded_runs": {
          "description": "Shadow and branch runs the report left out.",
          "format": "uint64",
          "minimum": 0.0,
          "type": "integer"
        },
        "production_runs": {
          "description": "Runs recorded as production that the report read.",
          "format": "uint64",
          "minimum": 0.0,
          "type": "integer"
        },
        "unrecorded_runs": {
          "description": "Runs with no recorded scope that the report read.",
          "format": "uint64",
          "minimum": 0.0,
          "type": "integer"
        },
        "unrecorded_runs_counted": {
          "description": "`true` when runs with no recorded scope count as production in this report. Their write target is unknown.",
          "type": "boolean"
        }
      },
      "required": [
        "excluded_runs",
        "production_runs",
        "unrecorded_runs",
        "unrecorded_runs_counted"
      ],
      "type": "object"
    }
  },
  "description": "JSON output for `rocky optimize`.\n\n`recommendations` is empty when no run history exists; `message` is populated in that case to explain why.",
  "properties": {
    "command": {
      "type": "string"
    },
    "message": {
      "type": [
        "string",
        "null"
      ]
    },
    "recommendations": {
      "items": {
        "$ref": "#/definitions/OptimizeRecommendation"
      },
      "type": "array"
    },
    "run_scope": {
      "allOf": [
        {
          "$ref": "#/definitions/ProductionRunScope"
        }
      ],
      "default": {
        "excluded_runs": 0,
        "production_runs": 0,
        "unrecorded_runs": 0,
        "unrecorded_runs_counted": false
      },
      "description": "Which runs the recommendations were computed from. Shadow and branch runs are left out; runs with no recorded scope are counted, so history from before #2200 still informs the averages (#2201)."
    },
    "total_models_analyzed": {
      "format": "uint",
      "minimum": 0.0,
      "type": "integer"
    },
    "version": {
      "type": "string"
    }
  },
  "required": [
    "command",
    "recommendations",
    "total_models_analyzed",
    "version"
  ],
  "title": "OptimizeOutput",
  "type": "object"
}
