{
  "version": "0.0.0-SENTINEL",
  "command": "optimize",
  "recommendations": [
    {
      "model_name": "orders",
      "current_strategy": "unknown",
      "recommended_strategy": "unknown",
      "estimated_monthly_savings": 0.0,
      "reasoning": "current strategy is unknown (model not found in the compiled project); no recommendation",
      "compute_cost_per_run": 0.0,
      "storage_cost_per_month": 0.0023,
      "downstream_references": 0
    }
  ],
  "total_models_analyzed": 1,
  "run_scope": {
    "unrecorded_runs_counted": true,
    "production_runs": 2,
    "unrecorded_runs": 0,
    "excluded_runs": 0
  }
}
